### ISSUE TITLE
TCP connection terminated

### ISSUE THREAD

**Issue by Heena2411** [paullouisageneau/libdatachannel#1360]
I have 1-minute video chunks that I’m trying to send over WebSocket.
I can successfully send data over WebSocket with lower bitrate and framerate.(chunk size is approx 1.5MB)

However, with higher framerate and bitrate, the WebSocket terminates during data transmission.(chunk size is approx 21MB)

I have collected a TCP dump that shows an invalid opcode for the packet.
But when I try multiple times with the same data, it works occasionally.

Can someone help me debug this issue?
library logs 
```c
Entering poll
2025-03-24 15:08:17.347 VERB  [85129] [rtc::impl::TcpTransport::send@91] Send size=4096
2025-03-24 15:08:17.347 VERB  [85129] [rtc::impl::PollService::add@58] Registering socket in poll service, direction=both
2025-03-24 15:08:17.347 VERB  [85002] [rtc::impl::PollService::runLoop@184] Exiting poll
2025-03-24 15:08:17.347 VERB  [85129] [rtc::impl::TcpTransport::send@91] Send size=96
2025-03-24 15:08:17.347 VERB  [85002] [rtc::impl::PollService::runLoop@178] Entering poll
2025-03-24 15:08:17.347 VERB  [85129] [rtc::impl::PollService::add@58] Registering socket in poll service, direction=both
2025-03-24 15:08:17.347 VERB  [85002] [rtc::impl::PollService::runLoop@184] Exiting poll
2025-03-24 15:08:17.347 VERB  [85002] [rtc::impl::PollService::runLoop@178] Entering poll
2025-03-24 15:08:17.350 VERB  [85002] [rtc::impl::PollService::runLoop@184] Exiting poll
2025-03-24 15:08:17.351 VERB  [85002] [rtc::impl::PollService::process@122] Poll error event
2025-03-24 15:08:17.351 WARN  [85002] [rtc::impl::TcpTransport::process@394] TCP connection terminated
2025-03-24 15:08:17.351 INFO  [85002] [rtc::impl::TcpTransport::process@441] TCP disconnected
2025-03-24 15:08:17.351 VERB  [85002] [rtc::impl::PollService::remove@71] Unregistering socket in poll service
2025-03-24 15:08:17.351 VERB  [85002] [rtc::impl::WebSocket::close@114] Closing WebSocket
2025-03-24 15:08:17.351 INFO  [85002] [rtc::impl::WsTransport::close@90] WebSocket closing
2025-03-24 15:08:17.351 DEBUG [85002] [rtc::impl::WsTransport::sendFrame@341] WebSocket sending frame: opcode=8, length=0
2025-03-24 15:08:17.351 VERB  [85002] [rtc::impl::TlsTransport::send@404] Send size=6
2025-03-24 15:08:17.351 DEBUG [85002] [rtc::impl::WsTransport::close@95] Unable to send WebSocket close frame: Connection is not open
2025-03-24 15:08:17.351 VERB  [85002] [rtc::impl::WebSocket::closeTransports@391] Closing transports
2025-03-24 15:08:17.352 VERB  [85002] [rtc::impl::PollService::runLoop@178] Entering poll
2025-03-24 15:08:17.352 INFO  [85131] [rtc::impl::TlsTransport::runRecvLoop@486] TLS closed
2025-03-24 15:08:17.352 VERB  [85002] [rtc::impl::PollService::runLoop@184] Exiting poll
2025-03-24 15:08:17.352 VERB  [85002] [rtc::impl::PollService::runLoop@178] Entering poll

 
``` 
TCPdump
```c
Frame 78201: 1514 bytes on wire (12112 bits), 1514 bytes captured (12112 bits)
Ethernet II, Src: :0c:98 (mac1), Dst: :4a:98 (mac2)
Internet Protocol Version 4, Src: x.x.x.x, Dst: y.y.y.y
Transmission Control Protocol, Src Port: 51668, Dst Port: 8080, Seq: 42373365, Ack: 184, Len: 1448
    Source Port: 51668
    Destination Port: 8080
    [Stream index: 4]
    [TCP Segment Len: 1448]
    Sequence number: 42373365    (relative sequence number)
    Sequence number (raw): 3493491758
    [Next sequence number: 42374813    (relative sequence number)]
    Acknowledgment number: 184    (relative ack number)
    Acknowledgment number (raw): 291306426
    1000 .... = Header Length: 32 bytes (8)
    Flags: 0x010 (ACK)
    Window size value: 501
    [Calculated window size: 64128]
    [Window size scaling factor: 128]
    Checksum: 0x5d97 [unverified]
    [Checksum Status: Unverified]
    Urgent pointer: 0
    Options: (12 bytes), No-Operation (NOP), No-Operation (NOP), Timestamps
    [Timestamps]
    TCP payload (1448 bytes)
    [PDU Size: 10120]
    TCP segment data (34 bytes)
    [PDU Size: 70]
    TCP segment data (1344 bytes)
[8 Reassembled TCP Segments (10120 bytes): #78194(1398), #78195(1448), #78196(1448), #78197(1448), #78198(1448), #78199(1448), #78200(1448), #78201(34)]
    [Frame: 78194, payload: 0-1397 (1398 bytes)]
    [Frame: 78195, payload: 1398-2845 (1448 bytes)]
    [Frame: 78196, payload: 2846-4293 (1448 bytes)]
    [Frame: 78197, payload: 4294-5741 (1448 bytes)]
    [Frame: 78198, payload: 5742-7189 (1448 bytes)]
    [Frame: 78199, payload: 7190-8637 (1448 bytes)]
    [Frame: 78200, payload: 8638-10085 (1448 bytes)]
    [Frame: 78201, payload: 10086-10119 (34 bytes)]
    [Segment count: 8]
    [Reassembled TCP length: 10120]
    [Reassembled TCP Data: 97fe278023df12b1a52c5d20f84378d9dbc7c3c5e223da90…]
WebSocket
    1... .... = Fin: True
    .001 .... = Reserved: 0x1
    .... 0111 = Opcode: Unknown (7)
    1... .... = Mask: True
    .111 1110 = Payload length: 126 Extended Payload Length (16 bits)
    Extended Payload length (16 bits): 10112
    Masking-Key: 23df12b1
    Masked payload
    Payload
        Unknown: 86f34f91db9c6a68f818d174c1fcc8213305702e8e8b4f77…
WebSocket
    1... .... = Fin: True
    .101 .... = Reserved: 0x5
    .... 0011 = Opcode: Unknown (3)
    0... .... = Mask: False
    .100 0100 = Payload length: 68
    Payload
        Unknown: b781745c13de680f1a4f7c76e99795f23d8e5d4526dd34b4…

```

**Comment by paullouisageneau** [comment]
It looks like sent WebSocket frames are invalid. meaning incorrect data is sent to into the TCP connection. Does https://github.com/paullouisageneau/libdatachannel/pull/1361 fix the issue?

**Comment by Heena2411** [comment]
Thanks @paullouisageneau 

With the provided changes, the possibility of the WebSocket connection closing has been reduced.
